{
  "schemaVersion": "1.0.0",
  "runId": "eval-valid-state",
  "workspaceRoot": ".",
  "host": "codex",
  "createdAt": "2026-07-20T09:00:00Z",
  "updatedAt": "2026-07-20T09:00:00Z",
  "status": "planning",
  "currentPhaseId": "05-planning",
  "agents": [{ "id": "root", "role": "root-orchestrator", "status": "running" }],
  "edges": [],
  "phases": [{ "id": "05-planning", "title": "Planning", "status": "in_progress" }],
  "blockers": [],
  "artifacts": [],
  "checkpoints": [],
  "metadata": { "fixturePurpose": "schema-valid-1.0" }
}
