{
  "schemaVersion": "1.0.0",
  "runId": "2026-05-26-state-contract",
  "workspaceRoot": "/Users/matejcerny/Sites/lematodefuk-marketplace",
  "host": "codex",
  "createdAt": "2026-05-26T08:00:00Z",
  "updatedAt": "2026-05-26T11:30:00Z",
  "status": "implementing",
  "currentPhaseId": "06-implementation",
  "preferredLanguage": "cs-CZ",
  "agents": [
    {
      "id": "root",
      "role": "root-orchestrator",
      "status": "running",
      "displayName": "Root Orchestrator",
      "summary": "Coordinates user-facing orchestration lifecycle.",
      "shortLabel": "Run coordination",
      "intent": "Coordinate the run, route work to child agents, and keep user-facing state current.",
      "plannedWork": [
        "Track active phase, decisions, blockers, and handoffs.",
        "Delegate implementation and review work to the right child agents."
      ],
      "doneDefinition": "The run is verified, evidence is linked, and the next user decision is clear.",
      "startedAt": "2026-05-26T08:00:00Z",
      "updatedAt": "2026-05-26T11:30:00Z"
    },
    {
      "id": "implementation-lead",
      "role": "implementation-lead",
      "status": "running",
      "displayName": "Implementation Lead",
      "summary": "Owns implementation phase and verification.",
      "shortLabel": "Implementation lead",
      "intent": "Implement the approved plan and coordinate verification.",
      "plannedWork": [
        "Build the structured state contract and validation surface.",
        "Spawn bounded slice workers when the implementation can be split safely.",
        "Run tests and report verification evidence."
      ],
      "doneDefinition": "Implementation is complete, reviewed, verified, and linked to final evidence.",
      "startedAt": "2026-05-26T11:25:00Z",
      "updatedAt": "2026-05-26T11:30:00Z"
    }
  ],
  "edges": [
    {
      "fromAgentId": "root",
      "toAgentId": "implementation-lead",
      "relation": "delegates",
      "label": "delegated implementation"
    },
    {
      "fromAgentId": "implementation-lead",
      "toAgentId": "root",
      "relation": "reports_to",
      "label": "checkpoint reports"
    }
  ],
  "phases": [
    {
      "id": "05-planning",
      "title": "Planning",
      "status": "completed",
      "ownerAgentId": "root",
      "startedAt": "2026-05-26T10:50:00Z",
      "completedAt": "2026-05-26T11:20:00Z",
      "summary": "Concrete implementation plan approved.",
      "artifactRefs": ["plan"]
    },
    {
      "id": "06-implementation",
      "title": "Implementation",
      "status": "in_progress",
      "ownerAgentId": "implementation-lead",
      "startedAt": "2026-05-26T11:25:00Z",
      "completedAt": null,
      "summary": "Contract-first implementation is active.",
      "artifactRefs": ["implementation-phase"]
    }
  ],
  "blockers": [],
  "artifacts": [
    {
      "id": "plan",
      "kind": "markdown",
      "path": ".ant/orchestrator/2026-05-26-state-contract/phases/05-planning/implementation-plan.md",
      "title": "Implementation Plan",
      "phaseId": "05-planning",
      "agentId": "root",
      "updatedAt": "2026-05-26T11:20:00Z"
    },
    {
      "id": "implementation-phase",
      "kind": "markdown",
      "path": ".ant/orchestrator/2026-05-26-state-contract/phases/06-implementation/phase.md",
      "title": "Implementation Phase",
      "phaseId": "06-implementation",
      "agentId": "implementation-lead",
      "updatedAt": "2026-05-26T11:30:00Z"
    }
  ],
  "checkpoints": [
    {
      "id": "checkpoint-implementation-started",
      "timestamp": "2026-05-26T11:30:00Z",
      "title": "Implementation started",
      "severity": "info",
      "phaseId": "06-implementation",
      "agentId": "implementation-lead",
      "summary": "Preflight is complete and contract work is starting.",
      "artifactRefs": ["implementation-phase"]
    }
  ],
  "metadata": {
    "languageSource": "user-preference",
    "originalRiskTier": "high",
    "activeRiskTier": "high",
    "flowMode": "scout-plan-implement-review",
    "cycle": "initial-implementation",
    "rootMode": "dispatch-only",
    "targetBranch": "origin/master",
    "implementationBranch": "feature/state-contract"
  }
}
